{
  "$schema": "https://json-schema.org/draft/2020-12/schema",
  "$id": "https://github.com/camilomoreno/preguntas-icfes/schema/v1/paquete.schema.json",
  "title": "Paquete de preguntas ICFES",
  "type": "object",
  "required": ["estandar", "version_estandar", "nombre", "preguntas"],
  "additionalProperties": false,
  "properties": {
    "estandar": { "const": "preguntas-icfes" },
    "version_estandar": {
      "type": "string",
      "pattern": "^\\d+\\.\\d+\\.\\d+$",
      "description": "Versión SemVer del estándar que sigue este paquete, p. ej. \"1.0.0\"."
    },
    "nombre": { "type": "string", "minLength": 1 },
    "area": {
      "type": "string",
      "description": "Área o asignatura del paquete, en texto libre. Opcional."
    },
    "preguntas": {
      "type": "array",
      "minItems": 1,
      "items": { "$ref": "pregunta.schema.json" },
      "description": "Los id deben ser únicos dentro del paquete (invariante validada por validador/validar.js, no expresable en JSON Schema puro)."
    }
  }
}
